{
  "id": "trainingresult://worldspec/h1-menagerie-right-robotiq/blocked",
  "resultVersion": "0.1.0",
  "trainingProfileDigest": "sha256:95a118984d6e447f34df5637036dab898db1db56906358cb109d9249f49a6990",
  "targetBundleDigest": "sha256:07e8122f3c922c1ae65e3eca17c34af4cb7a5e92dc926ecb07da9fdbda95938b",
  "status": "blocked",
  "executionEvidence": "not_executed",
  "artifacts": [],
  "tests": [],
  "diagnostics": [
    {
      "code": "TRAINING_NOT_EXECUTED",
      "severity": "error",
      "message": "The digest-pinned Linux GPU OCI runtime passed an A800 MJX/Warp one-step probe, but PPO training has not executed and no policy checkpoint exists."
    }
  ],
  "generatedAt": "2026-07-28T14:50:50Z"
}
